{
  "$id": "template",
  "$schema": "http://json-schema.org/draft-07/schema#",
  "title": "template",
  "type": "object",
  "properties": {
    "execute_on": {
      "enum": ["proxmox", "lxc"]
    },
    "if": {
      "type": "boolean"
    },
    "name": {
      "type": "string",
      "maxLength": 30
    },
    "description": {
      "type": "string"
    },
    "parameters": {
      "type": "array",
      "items": {
        "type": "object",
        "properties": {
          "name": { "type": "string" },
          "type": { "enum": ["string", "number", "enum", "boolean"] },
          "description": { "type": "string" },
          "required": { "type": "boolean", "default": false },
          "secure": { "type": "boolean", "default": false },
          "default": { "type": ["string", "number", "boolean"] }
        },
        "if": { "properties": { "type": { "const": "enum" } } },
        "then": {
          "properties": {
            "enumValues": {
              "type": "array",
              "items": { "type": "string" }
            }
          }
        }
      }
    },
    "outputs": {
      "type": "array",
      "items": {
        "type": "string"
      }
    },
    "commands": {
      "type": "array",
      "minItems": 1,
      "items": {
        "type": "object",
        "properties": {
          "type": {
            "enum": ["command", "script", "template"],
            "default": "command"
          },
          "name": { "type": "string", "maxLength": 20 },
          "execute": { "type": "string" },
          "description": { "type": "string" }
        },
        "required": ["type", "execute"]
      }
    }
  },
  "if": {
    "properties": { "type": { "enum": ["command", "script", "template"] } }
  },
  "then": { "properties": { "enumValues": { "type": "string" } } },
  "required": ["commands", "execute_on", "name"]
}
